Ürün Ad?;Barkod;Kategori;Marka;Ürün Aç?klamas?;Sat?c? Stok Kodu;Varyant Grup Id;Stok Adedi;Idefix Sat?? Fiyat?;Piyasa Sat?? Fiyat?;KDV;Desi;Görsel 1;Görsel 2;Görsel 3;Görsel 4;Görsel 5;Görsel 6;Görsel 7;Görsel 8;Men?ei;Üretici Bilgisi;?thalatç? / Yetkili Temsilci / ?fa Hizmet Sa?lay?c?;CE Uygunluk Sembolü;Kullan?m Talimat? / Uyar?lar? Görseli;Paket Görseli (Ön);Paket Görseli (Arka);Ürün Bilgi Formu Görseli;Enerji S?n?f? Görseli;Enerji ve Besin De?erleri Görseli;Parti/Lot/SKT;Renk;Boyut/Ebat;Hayvansal Men?eli
2'li Set Yoga Yapan Yoda (Grogu) Figür - 10 cm 3D Yazıcı Baskı - Boyanabilir Ten Rengi;Dkrsyn16211;Karakter Figür Oyuncak;hivhestın;"Ürün Açıklaması Huzuru ve gücü temsil eden Yoga Yapan Yoda figürleri ile yaşam alanınıza spiritüel bir dokunuş katın.; Meditasyon pozundaki bu özel tasarım, 3D yazıcı teknolojisinin sunduğu detaylı işçilikle üretilmiştir.; Ürün Özellikleri Konsept: Yoga ve meditasyon yapan ikonik karakter tasarımı.; Paket İçeriği: 2 adet Yoga Yoda figürü birlikte gönderilir.; Boyut: 10 cm boyundadır.; Renk: Ten rengi (Boyamaya uygun zemin rengi).; Kullanım Alanı: Ofis masası, kitaplık, yoga stüdyosu veya ev dekorasyonu için idealdir.; PLA Malzeme Hakkında Bilgi Ürünlerimiz üretimde sürdürülebilirliği esas alan PLA (Polilaktik Asit) filament ile basılmaktadır.; Organik İçerik: Mısır nişastası ve şeker kamışı gibi bitkisel kaynaklardan elde edilir.; Kokusuz ve Güvenli: Plastik kokusu içermez, iç mekanlarda güvenle kullanılabilir.; Dayanıklı: Darbelere karşı dirençli ve formu bozulmayan bir yapıya sahiptir.; İster Dekoratif İster Hobi Amaçlı Bu figürler, ten rengi sayesinde sade ve şık bir dekoratif obje olarak doğrudan kullanılabilir.; Aynı zamanda pürüzsüz yüzeyi sayesinde akrilik boya ile boyanmaya çok uygundur.; Kendi sanatsal dokunuşunuzla figürünüzü kişiselleştirebilirsiniz.; Teslimat Bilgisi: Ürünler, taşıma esnasında zarar görmemesi için özenle paketlenerek gönderilmektedir.";Dkrsyn16211;Dkrsyn16211;100;575.0;575.0;20;0.0;https://cdn.dsmcdn.com/ty1807/prod/QC_PREP/20251229/22/3c987660-621d-3107-a156-3a9d9eba4110/1_org_zoom.jpg;;;;;;;;;;;;;;;;;;;;Tek Ebat;
Tiny Groot 3D Premium Koleksiyon Figürü - 10 cm Dekoratif Masa Üstü Objesi;Dkrsyn16210;Karakter Figür Oyuncak;hivhestın;"Ürün Açıklaması Yaşam alanlarınıza sevimlilik katacak, Marvel evreninin en sevilen karakterlerinden biri olan Groot şimdi 3D baskı teknolojisiyle sizlerle! İster çalışma masanızda size eşlik etsin, ister sevdiklerinize anlamlı bir hediye olsun.; Ürün Özellikleri: Karakter: Baby Groot Boyut: 10 cm Üretim Teknolojisi: Yüksek çözünürlüklü 3D Yazıcı (FDM) baskısı.; Renk: Kahverengi (Ahşap dokulu görünüm).; Kullanım Alanı: Ofis, ev dekorasyonu, kitaplık içi figür veya koleksiyon parçası.; Malzeme Hakkında Bilgi: PLA Nedir? Bu ürün, çevre dostu ve sağlığa duyarlı PLA (Polilaktik Asit) filament kullanılarak üretilmiştir.; Doğa Dostu: Mısır nişastası veya şeker kamışı gibi yenilenebilir kaynaklardan üretilen bir biyoplastiktir.; Güvenli: Petrol bazlı plastiklerin aksine, ev ortamında kullanım için tamamen güvenlidir ve kötü koku yaymaz.; Detay Kalitesi: 3D baskıda ince detayları en iyi yansıtan malzemelerden biridir; figür üzerindeki ağaç dokusunu net bir şekilde hissettirir.; Dayanıklılık: Hafif ve sert bir yapısı vardır.; Doğrudan yüksek ısıya (50-60 derecenin üzeri) maruz bırakılmaması önerilir.; Neden TinyGroot? Ürünümüz seri üretim plastik oyuncaklardan farklı olarak, katman katman işlenerek üretilen özel bir sanat ürünüdür.; Yüzeyindeki karakteristik çizgiler, 3D baskı teknolojisinin kendine has dokusunu ve el emeğini yansıtır.; Paket İçeriği: 1 adet 10 cm Kahverengi Groot Figürü";Dkrsyn16210;Dkrsyn16210;100;558.0;558.0;20;0.0;https://cdn.dsmcdn.com/ty1806/prod/QC_PREP/20251229/22/5335994f-c0b1-347c-b711-209b0e081469/1_org_zoom.jpg;;;;;;;;;;;;;;;;;;;;Tek Ebat;
Low Poly Dobby - 10 cm Dekoratif 3D Yazıcı Baskı Figür - Premium PLA;Dkrsyn16209;Karakter Figür Oyuncak;hivhestın;"Ürün Açıklaması Harry Potter evreninin en sevilen karakterlerinden biri olan Dobby, modern ve sanatsal ""Low Poly"" (düşük poligon) tasarımıyla masanıza konuk oluyor.; 3D yazıcı teknolojisi ile titizlikle üretilen bu figür, hem koleksiyoncular hem de dekorasyon tutkunları için benzersiz bir parçadır.; Ürün Özellikleri: Karakter: Dobby (Harry Potter Serisi) Tasarım Tarzı: Modern Low Poly (Geometrik hatlı) Boyut: 10 cm (Yükseklik) Malzeme: Yüksek kaliteli PLA Renk: Görseldeki metalik gri/füme tonlarındadır.; PLA Malzeme Hakkında Bilgilendirme Bu ürünün üretiminde kullanılan PLA (Polilaktik Asit), mısır nişastası veya şeker kamışı gibi yenilenebilir kaynaklardan elde edilen organik bir biyoplastiktir.; Doğa Dostudur: Petrol bazlı plastiklerin aksine doğada çözünebilir ve çevreye zarar vermez.; Sağlığa Zararsızdır: Gıda temasına uygun ham maddelerden üretildiği için ev ve ofis ortamında güvenle kullanılabilir, keskin bir kimyasal koku yaymaz.; Detay Kalitesi: 3D baskıda pürüzsüz ve net geometrik hatlar sunarak görseldeki estetik görünümü sağlar.; Kullanım ve Bakım Önerileri Ürün dekoratif amaçlıdır.; PLA malzemenin doğası gereği, figürü 50°C üzerindeki yüksek ısıya (direkt güneş altındaki kapalı araç içi gibi) maruz bırakmamanız önerilir; bu durum formda esnemeye neden olabilir.; Nemli bir bezle kolayca temizlenebilir.; Paket İçeriği: 1 Adet 10 cm Low Poly Dobby Figürü.";Dkrsyn16209;Dkrsyn16209;100;609.0;609.0;20;0.0;https://cdn.dsmcdn.com/ty1807/prod/QC_PREP/20251229/22/1a2d83d8-0fd4-3963-821d-11e049dab034/1_org_zoom.jpg;;;;;;;;;;;;;;;;;;;;Tek Ebat;
LOVE Serisi 3 Boyutlu Tasarım Kırmızı Anahtarlık Seti - 3 Adet;Anhtrlk1634;Anahtarlık;hivhestın;"Ürün Açıklaması Retro Pop-Art LOVE 3D Baskı Anahtarlık Seti (3 Adet) Modern tasarımın teknolojiyle buluştuğu bu özel anahtarlık seti, stilini anahtarlarına taşımak isteyenler için tasarlandı.; Robert Indiana’nın ikonik Pop-Art eserinden ilham alınarak 3D yazıcı teknolojisiyle üretilen bu anahtarlıklar, hem dayanıklı hem de çevre dostudur.; Ürün Özellikleri: Paket İçeriği: 3 adet kırmızı renkli LOVE anahtarlık.; Boyut: Her bir anahtarlık yaklaşık 5 cm uzunluğundadır.; İdeal boyutu sayesinde cebinizde veya çantanızda fazla yer kaplamaz, kolayca bulunur.; Üretim Teknolojisi: En son teknoloji 3D Yazıcılar ile katman katman işlenerek üretilmiştir.; Renk: Canlı ve dikkat çekici mat kırmızı.; Kullanım Alanları: Ev anahtarı, araba anahtarı, çanta aksesuarı veya sevdiklerinize küçük bir hediye olarak mükemmel bir tercihtir.; PLA Malzeme Nedir? Bu ürün üretiminde PLA (Polilaktik Asit) kullanılmıştır.; PLA hakkında bilmeniz gerekenler: Çevre Dostudur: Mısır nişastası veya şeker kamışı gibi yenilenebilir kaynaklardan üretilen biyoplastik bir malzemedir.; Petrol türevli plastikler gibi doğaya zarar vermez.; Sağlığa Zararsızdır: Organik bileşenlerden oluştuğu için mutfak ürünlerinden oyuncaklara kadar güvenle kullanılır.; Dayanıklılık: Hafif ama oldukça sağlam bir yapıya sahiptir.; Günlük kullanımda darbelere karşı dirençlidir.; Not: 3D baskı teknolojisinin doğası gereği ürün yüzeyinde çok ince katman izleri görülebilir.; Bu durum her bir ürünü teknik olarak benzersiz kılar.";Anhtrlk1634;Anhtrlk1634;100;289.0;289.0;20;0.0;https://cdn.dsmcdn.com/ty1804/prod/QC_PREP/20251228/02/faf435d7-7bcf-3fcb-af60-89b8a4f2ba0f/1_org_zoom.jpg;https://cdn.dsmcdn.com/ty1805/prod/QC_PREP/20251228/02/b9bf54d6-6241-39eb-8e4f-0507cb6a82c6/1_org_zoom.jpg;https://cdn.dsmcdn.com/ty1804/prod/QC_PREP/20251228/02/c420a340-1628-382d-96fa-a4693371c040/1_org_zoom.jpg;;;;;;;;;;;;;;;;;Kırmızı;Tek Ebat;
Grinch Tasarımlı Çok Amaçlı Dekoratif Saklama Kutusu;Dkrsyn16208;Dekoratif Kutu;hivhestın;"Ürün Açıklaması Evine veya ofisine biraz renk ve eğlence katmak isteyenler için özel olarak tasarlanmış Grinch Temalı Saklama Kutusu şimdi satışta! 3D yazıcı teknolojisi ile titizlikle üretilen bu kutu, hem dekoratif bir obje hem de fonksiyonel bir düzenleyici olarak kullanılabilir.; Karakterin ikonik yüz hatlarını taşıyan kapağı ve derin iç hacmiyle; anahtarlarınızı, takılarınızı, ofis malzemelerinizi veya küçük hatıralarınızı saklamak için mükemmel bir tercihtir.; Ürün Özellikleri Tasarım: İkonik Grinch karakteri temalı, yüksek detaylı kapak tasarımı.; Boyutlar: 16 cm (Boy) x 14 cm (En) x 4 cm (Yükseklik).; Kullanım: Geçmeli kapak yapısı sayesinde kolayca açılıp kapanır.; Kullanım Alanları: Masa üstü düzenleyici, takı kutusu, şekerleme kutusu veya sadece dekoratif amaçlı kullanım.; Üretim Teknolojisi ve Malzeme Hakkında Bilgi Ürünümüz 3D Yazıcı (FDM) teknolojisi kullanılarak katman katman üretilmiştir.; Üretimde malzeme olarak PLA (Polilaktik Asit) tercih edilmiştir.; PLA Nedir? Doğa Dostu: PLA, mısır nişastası veya şeker kamışı gibi yenilenebilir kaynaklardan üretilen biyobozunur bir termoplastiktir.; Çevreye zarar vermez.; Sağlığa Zararsız: Petrol bazlı plastiklerin aksine, ev içi kullanımda ve temas durumunda sağlığa zararlı toksik maddeler içermez.; Dayanıklılık: Hafif ama sert bir yapısı vardır.; Dekoratif ürünler için en ideal ve estetik sonuç veren malzemedir.; Bakım: PLA malzeme yüksek sıcaklıklara (60 derece ve üzeri) maruz kalmamalıdır.; Bu nedenle bulaşık makinesinde yıkanması önerilmez, nemli bir bezle temizliği kolayca yapılabilir.; Paket İçeriği 1 adet Grinch Tasarımlı Alt Gövde ve 1 adet Grinch Yüz Figürlü Kapak.";Dkrsyn16208;Dkrayn16208;50;700.0;700.0;20;0.0;https://cdn.dsmcdn.com/ty1800/prod/QC_PREP/20251220/23/4d728660-a373-3692-97e9-fc6ce933fffc/1_org_zoom.jpg;https://cdn.dsmcdn.com/ty1802/prod/QC_PREP/20251220/23/1f1af561-5602-3e92-b668-2d23a6b2e118/1_org_zoom.jpg;https://cdn.dsmcdn.com/ty1800/prod/QC_PREP/20251220/23/5aa8d4a4-55b3-3d0f-b131-66935c2ec54d/1_org_zoom.jpg;https://cdn.dsmcdn.com/ty1800/prod/QC_PREP/20251220/23/d580a29d-d1d8-3875-88d1-b0dff60d2b20/1_org_zoom.jpg;;;;;;;;;;;;;;;;Yeşil;Tek Ebat;
Yılbaşının En Komik Hali: 4'lü Poz Veren Bebek Noel Baba Figür Seti - 3D Tasarım Dekoratif Süs;Dkrsyn16207;Yılbaşı Süsü;hivhestın;"Ürün Açıklaması Yeni yıla girerken sevdiklerini gülümsetmek ya da evinde/ofisinde alışılmışın dışında bir dekorasyon oluşturmak isteyenler için özel olarak tasarlandı! Bu sevimli ve muzip Bebek Noel Baba figürleri, klasik yılbaşı süslerinden sıkılanlar için harika bir alternatif.; Ürün Detayları: Paket İçeriği: 4 adet Bebek Noel Baba Figürü.; Boyut: Yaklaşık 5-6 cm (Her biri el avucuna sığacak, masa üstü veya raf için ideal boyuttadır).; Üretim Teknolojisi: En son teknoloji 3D Yazıcılar (3D Printing) ile yüksek detay kalitesinde üretilmiştir.; Tasarım: Dirseğine dayanmış, muzip bir poz veren bebek Noel baba formu.; PLA Malzeme Hakkında Bilgilendirme Bu ürünün üretiminde yüksek kaliteli PLA (Polilaktik Asit) filament kullanılmıştır.; Neden PLA? Doğa Dostu: Mısır nişastası veya şeker kamışı gibi yenilenebilir kaynaklardan elde edilen biyoplastik bir malzemedir.; Doğada çözünebilir.; Sağlığa Duyarlı: Petrol bazlı plastikler gibi ağır kimyasallar içermez, iç mekan kullanımında güvenlidir.; Dayanıklılık: Sert ve dayanıklı bir yapıya sahiptir.; Hafif darbelere karşı dirençlidir ancak çok yüksek sıcaklıklara (50°C ve üzeri) doğrudan maruz bırakılmamalıdır (formu bozulabilir).; Neden Bu Ürünü Almalısınız? Eşsiz Bir Hediye: Arkadaşlarınıza veya iş arkadaşlarınıza verebileceğiniz en unutulmaz ve esprili yılbaşı hediyesi olabilir.; Dekoratif Şıklık: Bilgisayar masanızda, kitaplığınızda veya saksı kenarlarınızda neşeli bir hava yaratır.; Yerli Üretim: Her bir figür titizlikle basılmış ve kalite kontrolünden geçirilmiştir.; Not: Ürünler 3D yazıcı teknolojisi ile üretildiği için yüzeylerinde karakteristik çok ince katman izleri görülebilir.; Bu, ürünün fabrikasyon değil, size özel bir üretim olduğunun kanıtıdır.";Dkrsyn16207;Dkrsyn16207;50;732.0;732.0;20;0.0;https://cdn.dsmcdn.com/ty1801/prod/QC_PREP/20251220/23/0adf7b42-8f38-3272-8849-0c457e425090/1_org_zoom.jpg;https://cdn.dsmcdn.com/ty1800/prod/QC_PREP/20251220/23/55040744-4fea-3552-aa38-3766300a9069/1_org_zoom.jpg;https://cdn.dsmcdn.com/ty1801/prod/QC_PREP/20251220/23/e2d3aae1-0aee-3fc0-a7d5-30f7ac06301f/1_org_zoom.jpg;https://cdn.dsmcdn.com/ty1802/prod/QC_PREP/20251220/23/81a053d9-1b7d-3eb7-b97a-f60fb4c17744/1_org_zoom.jpg;;;;;;;;;;;;;;;;Bej;Tek Ebat;
Bulldog Temalı Dekoratif Anahtarlık ve Askılık - 3D Yazıcı Baskı - 22x22 cm;Dkrsyn16206;Askılık;hivhestın;"Ürün Açıklaması Evinizin girişine veya odanıza hem neşe hem de düzen getirecek bu özel tasarım Bulldog askılık, modern 3D yazıcı teknolojisi ile üretilmiştir.; Sevimli Bulldog figürü ve gökkuşağı renklerindeki kancalarıyla dekorasyonunuza şık bir dokunuş katar.; Ürün Özellikleri: Malzeme: Yüksek kaliteli PLA (Polilaktik Asit) Boyutlar: 22 cm x 22 cm Tasarım: Siyah gövde üzerine 5 farklı renkte (Kırmızı, Sarı, Yeşil, Mavi, Mor) fonksiyonel kanca.; Kullanım Alanı: Anahtarlık, maske askısı, takı düzenleyici veya hafif mutfak gereçleri için idealdir.; Montaj: Yan kısımlarda bulunan vida delikleri sayesinde duvara kolayca sabitlenebilir.; PLA Malzeme Hakkında Bilgi Bu ürünün üretiminde kullanılan PLA (Polilaktik Asit), mısır nişastası veya şeker kamışı gibi yenilenebilir kaynaklardan elde edilen bioplastik bir malzemedir.; Doğa Dostu: Fosil yakıt tabanlı plastiklerin aksine doğada biyolojik olarak parçalanabilir.; Sağlık: Üretim esnasında ve kullanımda çevreye zehirli gaz yaymaz, ev içi kullanıma tamamen uygundur.; Estetik: 3D baskı detaylarını en net şekilde yansıtan, pürüzsüz ve canlı renkler sunan bir malzemedir.; Dayanıklılık: Günlük kullanım için yeterli sertliğe ve dayanıklılığa sahiptir.; (Doğrudan yüksek ısıya veya uzun süre yoğun güneş ışığına maruz bırakılmaması önerilir.; ) Paket İçeriği 1 adet Bulldog Tasarımlı 5 Kancalı Askılık Not: Ürün 3D yazıcıda katmanlı üretim teknolojisiyle üretildiği için yüzeyinde bu teknolojiye has hafif dokular bulunabilir, bu durum ürüne fabrikasyon plastiklerin aksine el yapımı bir karakter kazandırır.";Dkrsyn16206;Dkrsyn16206;50;611.0;611.0;20;0.0;https://cdn.dsmcdn.com/ty1800/prod/QC_PREP/20251220/23/591461ef-d2cd-3f6a-8dd1-d8b32882bf74/1_org_zoom.jpg;https://cdn.dsmcdn.com/ty1801/prod/QC_PREP/20251220/23/1ee2d4aa-7c3d-3cae-ae18-9321ea31d968/1_org_zoom.jpg;https://cdn.dsmcdn.com/ty1801/prod/QC_PREP/20251220/23/fe464978-0565-3c6e-89db-360ed087069c/1_org_zoom.jpg;;;;;;;;;;;;;;;;;Siyah;Tek Ebat;
Husky Köpek Figürlü Dekoratif Renkli Anahtarlık ve Duvar Askılığı - 3D Yazıcı Baskı - 21x22 cm;Dkrsyn16205;Askılık;hivhestın;"Ürün Açıklaması Evinize veya ofisinize hem neşe hem de düzen getirecek bu özel tasarım Husky figürlü askılık, modern 3D yazıcı teknolojisi ile üretilmiştir.; Sevimli Husky tasarımı ve canlı renkli askı uçları sayesinde antre, çocuk odası veya mutfak gibi alanlarda dekoratif bir görünüm sunar.; Ürün Özellikleri Tasarım: Detaylı Husky köpek figürü ve gökkuşağı renklerinden esinlenen 5 adet dayanıklı askı ucu.; Kullanım Alanı: Anahtarlık, maske askısı, takı düzenleyici veya hafif mutfak gereçleri için idealdir.; Montaj: Üzerinde bulunan iki adet vida deliği sayesinde duvara kolayca sabitlenebilir.; Üretim Teknolojisi: Yüksek kaliteli 3D yazıcılar ile katman katman işlenerek üretilmiştir.; PLA Malzeme Hakkında Bilgi Bu ürünün üretiminde çevre dostu PLA (Polilaktik Asit) filament kullanılmıştır.; Doğa Dostu: Mısır nişastası, şeker kamışı ve şeker pancarı gibi yenilenebilir kaynaklardan üretilen organik bir biyoplastiktir.; Güvenli: Petrol bazlı plastikler gibi ağır kimyasallar içermez, ev ortamında ve çocuk odalarında güvenle kullanılabilir.; Dayanıklılık: Hafif ve sağlam bir yapısı vardır.; Not: PLA malzeme yapısı gereği 60 derece üzerindeki aşırı sıcaklıklara (direkt güneş ışığı altındaki araç içi gibi) uzun süre maruz bırakılmamalıdır.; Teknik Detaylar Genişlik: 21 cm Yükseklik: 22 cm Malzeme: %100 PLA (Organik Plastik) Askı Sayısı: 5 Adet (Kırmızı, Sarı, Yeşil, Mavi, Mor) Paket İçeriği: 1 adet Husky figürlü askılık.";Dkrsyn16205;Dkrsyn16205;50;580.0;580.0;20;0.0;https://cdn.dsmcdn.com/ty1802/prod/QC_PREP/20251220/22/982b53db-86b6-3eba-b576-b48704095416/1_org_zoom.jpg;https://cdn.dsmcdn.com/ty1802/prod/QC_PREP/20251220/22/b5600907-c573-38c4-81ad-be4ecce18de5/1_org_zoom.jpg;https://cdn.dsmcdn.com/ty1802/prod/QC_PREP/20251220/22/f3e03b46-7139-3843-801b-767bb9498f5a/1_org_zoom.jpg;;;;;;;;;;;;;;;;;Siyah;Tek Ebat;
3D Baskı Yılbaşı Oturan Yıldız Figür Dekor Süsü - 4 Adet;Dkrsyn16204;Yılbaşı Süsü;hivhestın;"Ürün Açıklaması Evinize veya ofisinize neşeli bir yılbaşı atmosferi katacak, rafta oturabilen özel tasarım 3D baskı yılbaşı dekoru.; Paket İçeriği: Bu ilanda toplam 4 adet sarı renkli, oturan yıldız figürü gönderilecektir.; Boyut: Her bir yıldız figürünün boyu yaklaşık 7 cm'dir.; Tasarım: Rafların, masaların veya vitrinlerin kenarına oturtulabilen esnek bacaklı (oturan figür) dekoratif süslerdir.; Kullanım Alanı: Yılbaşı ağacı altı, vitrin, masa veya raf dekorasyonu için idealdir.; Kullanılan Malzeme Hakkında Bilgi: PLA (Polilaktik Asit) Ürünlerimiz, 3D baskı teknolojisi kullanılarak PLA (Polilaktik Asit) malzemeden üretilmiştir.; Malzeme Özellikleri: Nedir? Mısır nişastası, şeker kamışı gibi yenilenebilir kaynaklardan elde edilen biyoplastik bir malzemedir.; Çevre Dostu: Biyobozunur (biodegradable) özelliktedir, bu sayede çevreye karşı daha duyarlı bir seçenektir.; Kullanım: Dekoratif amaçlı iç mekan kullanımı için uygundur.; Uyarı: Yüksek ısıya (örneğin doğrudan güneş ışığına veya ısı kaynaklarına) maruz bırakılmamalıdır, aksi takdirde şekil bozukluğu olabilir.; Su ile temizlenebilir, kimyasal temizleyicilerden kaçınılmalıdır.; Önemli Not 3D baskı teknolojisinin doğası gereği, ürün yüzeyinde katman izleri (çizgiler) bulunması normaldir ve bu durum ürünün bir kusuru değil, üretim yönteminin bir özelliğidir.";Dkrsyn16204;Dkrsyn16204;100;499.0;499.0;20;0.0;https://cdn.dsmcdn.com/ty1798/prod/QC_PREP/20251208/00/9d189a3c-9001-3733-8661-7ea1178e77d5/1_org_zoom.jpg;https://cdn.dsmcdn.com/ty1799/prod/QC_PREP/20251208/00/e1210dbb-ce2a-32d1-a373-37a7d0ecec17/1_org_zoom.jpg;https://cdn.dsmcdn.com/ty1798/prod/QC_PREP/20251208/00/fab4f79d-5fdf-3b55-bfb6-00c454278cfa/1_org_zoom.jpg;https://cdn.dsmcdn.com/ty1798/prod/QC_PREP/20251208/00/c0a3460e-d851-3a7d-9055-9a25d49b8db1/1_org_zoom.jpg;;;;;;;;;;;;;;;;Sarı;Tek Ebat;
Hareketli Bacaklı Kırmızı Örgü Desenli Yılbaşı Süsü (4 Adet) - 3D Baskı Dekor;Dkrsyn16203;Yılbaşı Süsü;hivhestın;"Ürün Açıklaması Bu eşsiz ve sevimli Hareketli Bacaklı Yılbaşı Dekoratif Süsü ile evinizin ve ağacınızın atmosferini değiştirin.; 3D Yazıcı teknolojisi ile üretilmiş bu özel tasarım, yılbaşı ruhunu eğlenceli ve modern bir dokunuşla yansıtıyor.; Ürün Özellikleri: Tasarım: İçi boş, zarif örgü deseni ve sallanabilir, hareketli eklemli bacaklar.; Malzeme: Yüksek kaliteli PLA (Polilaktik Asit) kullanılarak 3D yazıcı ile üretilmiştir.; Renk: Canlı Kırmızı (Askı kısmı kontrast oluşturan Turuncu/Altın rengindedir).; Boyut: Yaklaşık 7 cm (gövde ve bacaklar dahil).; Paket İçeriği: Belirtilen özelliklere sahip 4 adet yılbaşı süsü gönderilecektir.; PLA Malzeme Hakkında Bilgi Ürünümüzün üretiminde kullanılan PLA (Polilaktik Asit), 3D yazıcı teknolojisinde en popüler ve çevre dostu malzemelerden biridir.; Çevre Dostu: Mısır nişastası, şeker kamışı gibi yenilenebilir kaynaklardan elde edilen biyoplastiktir.; Doğada çözünebilir (kompostlanabilir) bir yapıya sahiptir.; Güvenli ve Kokusuz: Baskı sırasında veya sonrasında toksik duman yaymaz, güvenli bir kullanım sunar.; Estetik: Baskı detaylarını yüksek oranda korur ve canlı renklerin oluşmasına olanak tanır, bu da dekoratif ürünler için idealdir.; Dayanım: İç mekan kullanımı ve oda sıcaklığındaki dekorasyonlar için uygundur.; Kullanım Alanları ve Dekorasyon İpuçları Yılbaşı Ağacı Süsü: Standart askı halkası sayesinde ağacınızın dallarına kolayca asılabilir.; Raf ve Masa Dekoru: Hareketli bacakları sayesinde rafların, kitaplıkların veya pencere kenarlarının ucuna oturtularak sevimli bir ""sarkan"" görüntü oluşturulabilir.; Hediye: Yılbaşı hediyelikleri veya küçük sürprizler için benzersiz bir seçenektir.; Not: Bu ürün hassas 3D baskı tekniği ile üretilmiştir.; Yüksek sıcaklıktan, doğrudan güneş ışığından ve aşırı kuvvet uygulamaktan kaçınılması tavsiye edilir.";Dkrsyn16203;Dkrsyn16203;100;499.0;499.0;20;0.0;https://cdn.dsmcdn.com/ty1797/prod/QC_PREP/20251208/00/e96a1d8b-fa52-316e-ba45-e62fd56e9ae2/1_org_zoom.jpg;https://cdn.dsmcdn.com/ty1797/prod/QC_PREP/20251208/00/520b68ae-ec6b-36d5-98fc-34fc91e99585/1_org_zoom.jpg;https://cdn.dsmcdn.com/ty1799/prod/QC_PREP/20251208/00/f0709093-ac7e-306d-82b2-5d1a00c5aa3b/1_org_zoom.jpg;https://cdn.dsmcdn.com/ty1797/prod/QC_PREP/20251208/00/77a56104-119f-3f49-a2d3-01e2e67e78e8/1_org_zoom.jpg;;;;;;;;;;;;;;;;Kırmızı;Tek Ebat;
Yılbaşı Dekoru Özel Üretim: Hareketli Bacaklı Geometrik Kalp Figürü (3'lü Set);Dkrsyn16202;Yılbaşı Süsü;hivhestın;"Ürün Açıklaması Bu benzersiz ve sevimli Hareketli Bacaklı Geometrik Kalp Figürleri ile evinize, ofisinize veya sevdiklerinize anlamlı bir dokunuş katın.; Özellikle Yılbaşı Dekoru ve Sevgililer Günü gibi özel günler için mükemmel bir süs eşyasıdır.; Set İçeriği: İlanda gördüğünüz modelden 3 adet gönderilecektir.; Malzeme: Yüksek kaliteli PLA (Polilaktik Asit) kullanılarak 3D Yazıcı ile özenle üretilmiştir.; Boyut: Yaklaşık 6 cm boyundadır (oturma pozisyonuna göre değişebilir).; Tasarım: Modern geometrik kesimlere sahip kalbi ve hareket ettirilebilir eklemli bacakları sayesinde dilediğiniz yüzeye oturtup farklı pozisyonlar verebilirsiniz.; Renk: Parlak ve canlı kırmızı.; Neden PLA Malzeme? Figürlerinizin üretildiği PLA (Polilaktik Asit) hakkında bilmeniz gerekenler: Doğa Dostu ve Biyobozunur: PLA, mısır nişastası veya şeker kamışı gibi yenilenebilir kaynaklardan elde edilir.; Bu, onu piyasadaki en çevre dostu 3D yazıcı malzemelerinden biri yapar.; Güvenli ve Koksuz: Ev içi dekorasyon ve oyuncak yapımında yaygın olarak kullanılır.; Üretim veya kullanım sırasında zararlı duman veya koku yaymaz.; Hafif ve Dayanıklı: Baskısı yapılan ürünler hafif olmasına rağmen günlük kullanımda oldukça dayanıklıdır.; Ancak direkt güneş ışığına uzun süre maruz bırakılmamalı ve yüksek sıcaklıklardan (60°C üzeri) korunmalıdır.; Canlı Renkler: PLA, baskılarda parlak ve canlı renkler elde etmeye olanak tanır, bu da bu figürün göz alıcı kırmızı rengini mükemmel bir şekilde sergilemesini sağlar.; Kullanım Alanları ve Öneriler Yılbaşı Süsü: Kitaplık, masa, şömine veya raf kenarlarına oturtarak Yılbaşı temasına sevimli bir detay ekleyin.; Sevgililer Günü Hediyesi: Sevdiklerinize kalpten gelen, farklı ve kalıcı bir hediye verin.; Ofis Masası Dekoru: Çalışma ortamınıza neşe katacak kişisel bir dokunuş.; Not: 3D baskı teknolojisinin doğası gereği, yüzeylerde milimetrik katman izleri bulunabilir.; Bu, ürünün benzersizliğini ve üretim tekniğini gösterir.";Dkrsyn16202;Dkrsybn16202;100;349.0;349.0;20;0.0;https://cdn.dsmcdn.com/ty1798/prod/QC_PREP/20251208/00/dde060d6-7045-3553-9d5c-5c5e024a70b1/1_org_zoom.jpg;https://cdn.dsmcdn.com/ty1799/prod/QC_PREP/20251208/00/03bc836f-14fd-3759-8002-46c879b2c42d/1_org_zoom.jpg;https://cdn.dsmcdn.com/ty1799/prod/QC_PREP/20251208/00/89a4d74f-d502-38be-9648-143d90bc690c/1_org_zoom.jpg;https://cdn.dsmcdn.com/ty1799/prod/QC_PREP/20251208/00/7d81f2aa-137f-36b2-96f9-9134d57c0225/1_org_zoom.jpg;;;;;;;;;;;;;;;;Kırmızı;Tek Ebat;
