Asil At Başı Heykeli – 18 cm 3D Baskı Dekoratif Obje;Fgr1620-1;Dekoratif Obje ve Biblo;hivhestın;"Evinize, ofisinize veya çalışma alanınıza asil bir hava katacak, özel tasarım 3D baskı at başı heykeli.; Detaylı işçiliği ve etkileyici duruşu ile hem modern hem de klasik dekorasyonlara uyum sağlar.; Ürün Özellikleri:Boyut: Yaklaşık 18 cm yükseklik.; Malzeme: Yüksek kaliteli PLA (Polilaktik Asit) kullanılarak 3D yazıcı ile üretilmiştir.; Renk Seçenekleri: İlan görselindeki Siyah ve Mermer Gri (Görseldeki Açık Renk) seçenekleri mevcuttur.; Lütfen sipariş verirken renk seçiminizi belirtiniz.; Üretim Tekniği: FDM (Fused Deposition Modeling) 3D baskı teknolojisi ile katmanlı olarak üretilmiştir.; Bu teknikten kaynaklanan hafif katman izleri, ürünün el yapımı karakterini vurgular.; PLA Malzeme Nedir?Ürünümüzün üretiminde kullanılan PLA (Polilaktik Asit), günümüzde en popüler 3D baskı malzemelerinden biridir.; Çevre Dostu: Mısır nişastası, şeker kamışı gibi yenilenebilir kaynaklardan elde edilen biyolojik olarak parçalanabilir bir termoplastiktir.; Çevreye duyarlı bir seçimdir.; Güvenli ve Sağlam: Kokusuzdur ve dayanıklı yapısı sayesinde iç mekan dekorasyon ürünleri için idealdir.; Dikkat Edilmesi Gerekenler: Yüksek sıcaklıklara (50-60°C üzeri) uzun süre maruz bırakılmamalıdır (örneğin doğrudan güneş ışığı alan yerler veya ısı kaynaklarının yakını), aksi takdirde şeklinde bozulmalar meydana gelebilir.; Kullanım Alanları:Kitaplık ve Raf DekoruMasaüstü AksesuarıHediye AlternatifiSanatsal Obje KoleksiyonuNot: Görseldeki ürünler 3D yazıcı ile üretilmiştir.; El yapımı ürünlerde olduğu gibi, her üründe minimal düzeyde farklılıklar ve 3D baskı tekniğinden kaynaklanan ince katman izleri görülebilir.; Bu durum, ürünün kalitesini düşürmez, aksine ona özgün bir karakter katar.";Fgr1620-1;Fgr1620;3;649.0;649.0;20;;https://cdn.dsmcdn.com/ty1776/prod/QC_PREP/20251020/14/4fda61aa-f294-3ab2-95c9-a0adb1834516/1_org_zoom.jpg;https://cdn.dsmcdn.com/ty1776/prod/QC_PREP/20251020/14/f17e1b4b-e1a0-33d9-9a32-d5c2752037fc/1_org_zoom.jpg;https://cdn.dsmcdn.com/ty1776/prod/QC_PREP/20251020/14/369f36d0-d4bf-35b9-bbea-93ec161b0d17/1_org_zoom.jpg;https://cdn.dsmcdn.com/ty1777/prod/QC_PREP/20251020/14/39fe8a92-a541-3696-bd49-9d4765a1f191/1_org_zoom.jpg;;;;;;;;;;;;;;;;Siyah;Tek Ebat;
"Zamandan Dönen Işık: ""Hyperspace"" Tasarım Masa Lambası - 3D Baskı - USB Işık Kaynağı";Lamba1621;Masa ve Gece Lambası;hivhestın;"Hyperspace Masa Lambası ile Mekanınıza Modern Bir Dokunuş!Bu eşsiz tasarımlı masa lambası, modern çizgileri ve 3D baskının getirdiği detay zenginliği ile çalışma masanıza, komodinize ya da yaşam alanınıza sanatsal bir hava katacak.; Işığın geçtiği kum saati / hiperboloid benzeri orta kısım, mekana derinlik katan benzersiz bir görsel şölen sunar.; Ürün Özellikleri:Tasarım Adı: HyperspaceÜretim Teknolojisi: Yüksek hassasiyetli 3D Yazıcı BaskıMalzeme: Çevre Dostu ve Sürdürülebilir PLA (Polilaktik Asit)Ölçüler (Yaklaşık): 18 cm (Uzunluk) x 8 cm (Genişlik) x 8 cm (Yükseklik)Işık Kaynağı: Bambu Lab Led kit muadili yüksek kaliteli, USB kablolu ve açma/kapama ara anahtarlı (aparatlı) LED ışık kiti kullanılmıştır.; Güç Gereksinimi: 5V.; Lambanız herhangi bir standart USB girişinden (bilgisayar, powerbank, USB priz veya 5V adaptör) kolayca çalıştırılabilir.; Not: Ürüne adaptör dahil değildir.; PLA Malzeme Hakkında Bilgi:Ürünün ana yapım malzemesi olan PLA (Polilaktik Asit), 3D baskıda en çok tercih edilen malzemelerden biridir.; Doğa Dostu: Mısır nişastası, şeker kamışı gibi yenilenebilir kaynaklardan elde edilen biyolojik olarak parçalanabilir bir termoplastiktir.; Güvenli ve Kokusuz: Baskı sırasında veya kullanımda toksik duman yaymaz, bu da onu iç mekan kullanımı için ideal ve güvenli kılar.; Yüksek Detay: PLA, 3D yazıcılarda ince detayları ve karmaşık geometrileri yüksek hassasiyetle basmamıza olanak tanır.; Dayanıklılık: Doğrudan güneş ışığı ve yüksek ısıya (60°C üzeri) maruz bırakılmadığı sürece iç mekan kullanımında yeterli sağlamlık ve uzun ömür sunar.; Önemli Not: 3D baskı teknolojisinin doğası gereği, ürün yüzeyinde mikroskobik katman çizgileri (dokulu / tırtıklı görünüm) mevcuttur.; Bu, ürünün el yapımı ve özgünlüğünü gösteren bir özelliktir.";Lamba1621;Lamba1621;3;899.0;899.0;20;0.0;https://cdn.dsmcdn.com/ty1778/prod/QC_PREP/20251019/20/46eae331-0d1c-3ab5-9d4b-2b1bcb6eb9c8/1_org_zoom.jpg;https://cdn.dsmcdn.com/ty1778/prod/QC_PREP/20251019/20/3e8760fc-c13f-3eda-8dc3-4a804da2a376/1_org_zoom.jpg;https://cdn.dsmcdn.com/ty1778/prod/QC_PREP/20251019/20/48aa64f2-943c-30d3-bee3-6163954a8b63/1_org_zoom.jpg;https://cdn.dsmcdn.com/ty1778/prod/QC_PREP/20251019/20/ed5a927b-4e1b-34cd-bbbf-baea4961b101/1_org_zoom.jpg;;;;;;;;;;;;;;;;Siyah;Tek Ebat;
Rivendell Efsanesi: Yüzüklerin Efendisi Rivendell 3D Baskı Figür PLA Malzeme;Fgr1619;Karakter Figür Oyuncak;hivhestın;"Orta Dünya'nın en güzel ve mistik yerlerinden biri olan, Elflerin evi Rivendell (Ayrıkvadi) mekanının detaylı bir 3D baskı figürüdür.; Filmlerdeki ve kitaplardaki büyülü atmosferi, evinizin veya çalışma masanızın dekorasyonuna taşıyın.; Ürün Özellikleri:Tema: Yüzüklerin Efendisi - Rivendell (Ayrıkvadi) FigürüMalzeme: Yüksek Kaliteli PLA (Polilaktik Asit)Teknoloji: FDM (Erimiş Yığma Modelleme) 3D Yazıcı BaskıRenk: Doğal Kahverengi (Görsellerdeki gibi)Ölçüler (Yaklaşık):Genişlik: 21 cmDerinlik: 17 cmYükseklik: 7,5 cmNeden PLA Malzeme?Bu figür, 3D baskıda en yaygın ve çevre dostu malzemelerden biri olan PLA (Polilaktik Asit) ile üretilmiştir.; Çevre Dostu: PLA, mısır nişastası, şeker kamışı gibi yenilenebilir kaynaklardan elde edilen bitki bazlı bir plastiktir.; Biyolojik olarak parçalanabilir olması sayesinde çevreye duyarlı bir tercihtir.; Güvenli ve Kokusuz: Baskı sırasında veya sonrasında toksik duman yaymaz, bu nedenle iç mekan kullanımı için güvenlidir.; İyi Detay Kalitesi: PLA, detayların net bir şekilde basılmasına olanak tanır, bu sayede Rivendell'in karmaşık mimarisi başarılı bir şekilde aktarılmıştır.; Hafif ve Dayanıklı: Kolay taşınabilir ve dekorasyon amaçlı kullanıma uygun bir sağlamlığa sahiptir.; Önemli Not: 3D baskı teknolojisinin doğası gereği, ürün yüzeyinde katman çizgileri (izler) bulunabilir.; Bu, ürünün benzersizliğini ve üretim yöntemini gösteren doğal bir özelliktir.; Kullanım Alanları:Masaüstü, raf veya kitaplık dekorasyonuYüzüklerin Efendisi koleksiyonu parçasıFilm/Fantastik temalı oyun veya çalışma odası dekorasyonuFantastik film seven dostlarınıza benzersiz bir hediye";Fgr1619;Fgr1619;2;699.0;699.0;20;0.0;https://cdn.dsmcdn.com/ty1775/prod/QC_PREP/20251019/16/4cd8bf80-8ed9-3431-83c4-986d3cfec0aa/1_org_zoom.jpg;https://cdn.dsmcdn.com/ty1773/prod/QC_PREP/20251019/16/664f7b31-584b-3fb8-83c1-b420910e0a33/1_org_zoom.jpg;https://cdn.dsmcdn.com/ty1774/prod/QC_PREP/20251019/16/aaf612c7-e0d4-30f3-b7c3-20664f4ab40c/1_org_zoom.jpg;;;;;;;;;;;;;;;;;;Tek Ebat;
Samuray Ruhu - Zen Ağacı 3D Baskı | PLA Malzeme | Japon Kültürü Masaüstü Heykeli;Dkrsyn16125;Dekoratif Obje ve Biblo;hivhestın;"Samuray Ruhu - Zen Ağacı 3D Baskı Dekoratif Heykel ile yaşam alanlarınıza Japon kültürünün asil ve dingin ruhunu taşıyın.; Bu özel tasarım, kılıcını savurmaya hazır bir samuray figürünü, beyaz çiçekli zarif bir zen ağacı altında betimlemektedir.; Siyahın güçlü duruşu ve beyazın saflığı birleşerek modern ve anlamlı bir dekorasyon parçası oluşturur.; Ürün Özellikleri:Malzeme: PLA (Polilaktik Asit)Üretim Tekniği: Yüksek hassasiyetli 3D Yazıcı BaskıRenk: Samuray ve Zemin Siyah, Ağaç Yaprakları BeyazBoyutlar (Yaklaşık):Yükseklik: 10 cmGenişlik: 12 cmTasarım Detayları: Japon estetiğini yansıtan ince işçilik ve hareketli bir figür.; Masaüstü, raf veya vitrinleriniz için ideal bir sanat eseri.; PLA Malzeme BilgilendirmesiÜrünümüz, PLA (Polilaktik Asit) adı verilen popüler bir 3D baskı malzemesi kullanılarak üretilmiştir.; Nedir? PLA, mısır nişastası, şeker kamışı gibi yenilenebilir kaynaklardan elde edilen biyolojik olarak parçalanabilir bir termoplastiktir.; Çevre Dostu: Biyolojik kökenli olması sayesinde, diğer plastik türlerine göre daha çevre dostu bir alternatiftir.; Kullanım: Genellikle iç mekân dekoratif ürünleri ve hobi amaçlı baskılarda tercih edilir.; Sağlığa zararlı bir madde içermez.; Dayanıklılık: Hafif ve sağlam bir yapıya sahiptir.; Önemli Not: Doğrudan güneş ışığına veya yüksek sıcaklıklara (50°C üzeri) uzun süre maruz bırakılmamalıdır.; Bu, malzemenin formunun bozulmasına neden olabilir.; Neden Samuray Ruhu'nu Seçmelisiniz?Kişisel ofisler, ev dekorasyonu veya oyun odaları için benzersiz bir atmosfer yaratır.; Samuray ve Uzak Doğu kültürü hayranları için mükemmel bir hediyelik eşyadır.3D baskının modern teknoloji ile geleneksel sanatı buluşturduğu özel bir üründür.; Hemen sipariş verin, yaşam alanınıza asalet ve dinginlik katın!";Dkrsyn16125;Dkrsyn16125;5;429.0;429.0;20;0.0;https://cdn.dsmcdn.com/ty1774/prod/QC_PREP/20251019/16/f4d30b1c-1690-33c2-9fec-c9a54b1371e4/1_org_zoom.jpg;https://cdn.dsmcdn.com/ty1775/prod/QC_PREP/20251019/16/7ba26ac3-dbd1-37d2-a185-2c29ab4f856a/1_org_zoom.jpg;https://cdn.dsmcdn.com/ty1774/prod/QC_PREP/20251019/16/fa0b3b06-dcc8-33d1-95ec-250af012e374/1_org_zoom.jpg;https://cdn.dsmcdn.com/ty1773/prod/QC_PREP/20251019/16/6a05d895-69f4-3ea6-9908-41a3f1e98df3/1_org_zoom.jpg;;;;;;;;;;;;;;;;Siyah;Tek Ebat;
Gizemli Baykuş Heykeli - Modern Dekoratif Obje | 13 cm.3D Baskı Sanatı |;Dkrsyn16123;Dekoratif Obje ve Biblo;hivhestın;"Gizemli Baykuş Heykeli: Modern ve Estetik TasarımEvinizin veya ofisinizin atmosferine sofistike ve sanatsal bir dokunuş katacak, 3D yazıcı teknolojisiyle üretilmiş eşsiz bir dekoratif objedir.; Baykuş figürünün zarif, spiral ve boşluklu tasarımı, modern sanatı yaşam alanınıza taşıyor.; Ürün Özellikleri:Boyut: Yükseklik 13 cmMalzeme: PLA Filament (Polilaktik Asit)Üretim Teknolojisi: FDM 3D Yazıcı BaskıRenk: (Görsellerdeki renge göre belirtiniz: Koyu Gri/Siyah)Kullanım Alanı: Kitaplık, çalışma masası, TV ünitesi, sehpa ve her türlü iç mekan dekorasyonu için idealdir.; Not: El yapımı ve 3D baskı teknolojisi sebebiyle, yüzeyde milimetrik katman izleri (baskı çizgileri) bulunabilir.; Bu, ürünün üretim tekniğinin doğasıdır ve kusur teşkil etmez.; PLA Malzeme Hakkında BilgiÜrünümüz, günümüzde 3D yazıcı teknolojisinde en yaygın kullanılan filament türlerinden biri olan PLA (Polilaktik Asit) malzemeden üretilmiştir.; Doğa Dostu: Mısır nişastası ve şeker kamışı gibi yenilenebilir kaynaklardan elde edilen organik bir biyopolimer ve termoplastiktir.; Çevre dostu ve biyobozunur bir malzemedir.; Kullanım Güvenliği: İnsan sağlığına zararlı değildir ve baskı sırasında neredeyse hiç kokuya neden olmaz.; Yapısal Özellikler: Sert bir yapıya sahiptir.; Dekoratif ve prototip amaçlı kullanımlar için oldukça uygundur.; Önemli Uyarı: Yüksek sıcaklığa karşı direnci düşüktür.; Direkt güneş ışığına veya 50-60°C üzerindeki sıcaklıklara uzun süre maruz bırakılmamalıdır.";Dkrsyn16123;Dkrsyn16123;10;389.0;389.0;20;0.0;https://cdn.dsmcdn.com/ty1775/prod/QC_PREP/20251019/16/452803e4-564e-3975-8618-a6cdeeb2a3ec/1_org_zoom.jpg;https://cdn.dsmcdn.com/ty1775/prod/QC_PREP/20251019/16/29e28262-c509-3015-808a-4e2a5173088f/1_org_zoom.jpg;;;;;;;;;;;;;;;;;;Siyah;Tek Ebat;
Eriyen Vazo Tasarım 3D Baskı | Damlayan Detaylı Dekoratif Saksı | PLA Malzeme | 20 cm;Vazo1623;Vazo;hivhestın;"Evinize modern ve sanatsal bir dokunuş katacak, göz alıcı Erimiş Vazo'yu sunuyoruz.; Bu özel tasarım vazo, üst kısmındaki canlı turuncu renkli erimiş/damlayan efekt ile alt kısmındaki sakin gri rengin çizgili dokusunu birleştirerek dikkat çekici bir kontrast yaratır.; İçine koyacağınız kuru çiçekler veya dallarla sonbahar ve kış dekorasyonlarınızın yıldızı olacak.; Ürün Özellikleri:Tasarım: Modern, damlayan/erimiş görünümlü üst kısım ve dikey çizgili silindir alt kısım.; Malzeme: Yüksek kaliteli ve çevre dostu PLA (Polilaktik Asit) filament kullanılarak 3D yazıcı teknolojisi ile üretilmiştir.; Boyut: Yaklaşık 20 cm yükseklik.; (Detaylı ölçüler için lütfen teknik özelliklere bakınız.; )Renkler: Turuncu (Üst Kısım) ve Gri (Alt Kısım).; Kullanım Alanı: Salon, ofis, çalışma masası ve modern dekorasyonlu her alanda dekoratif amaçlı kullanıma uygundur.; (Not: 3D baskı ürünlerin sızdırmazlıkları tam garanti edilemeyebilir, bu nedenle kuru veya yapay çiçeklerle kullanılması tavsiye edilir.; )Neden 3D Baskı?Bu ürün, standart üretim yöntemleriyle üretilmesi zor olan detaylı ve özgün bir tasarıma sahiptir.; 3D baskı teknolojisi sayesinde her bir vazo, sanatsal bir hassasiyetle size özel olarak üretilmektedir.; 🌟 PLA Malzeme Hakkında Bilgilendirme (Müşteriye Özel Not)Bu ürünün üretiminde kullanılan PLA (Polilaktik Asit), 3D baskıda en yaygın tercih edilen ve çevre dostu bir termoplastik malzemedir.; PLA'nın Avantajları:Doğa Dostu: Mısır nişastası, şeker kamışı gibi yenilenebilir kaynaklardan elde edilir ve biyolojik olarak çözünebilir (kompost edilebilir) bir yapıya sahiptir.; Güvenli ve Kokusuz: Baskı sırasında veya sonrasında toksik duman yaymaz, iç mekan kullanımı için güvenlidir.; Hafif ve Dayanıklı: Kolay kırılmayan, hafif ve dekoratif amaçlı kullanım için yeterli dayanıklılığa sahip bir malzemedir.; Önemli Not: PLA, yüksek sıcaklıklara (örneğin doğrudan güneş ışığı altında kalan araba içi) karşı hassastır.; Ürünün şeklinin bozulmaması için aşırı sıcak ortamlardan ve direkt ısı kaynaklarından uzak tutulması önerilir.; Temizliği nemli bir bezle yapılmalıdır.";Vazo1623;Vazo1623;3;1299.0;1299.0;20;0.0;https://cdn.dsmcdn.com/ty1775/prod/QC_PREP/20251019/15/31b5d959-370c-385c-9862-6f48e56eecf5/1_org_zoom.jpg;;;;;;;;;;;;;;;;;;;Turuncu;Tek Ebat;
Sallanan Bacaklı Sevimli Kar Tanesi Figürü - Şık Masa/Raf Dekoru 2 adet;Dkrsyn16124;Yılbaşı Süsü;hivhestın;"Evinize ve ofisinize eğlenceli ve şık bir kış dokunuşu katacak 2 adet 3D yazıcı baskısı dekoratif figür.; Ürün Özellikleri:Adet: Paket içerisinde 2 adet Kar Tanesi Figürü bulunmaktadır.; Malzeme: Yüksek kaliteli ve çevre dostu PLA (Polilaktik Asit) kullanılarak 3D yazıcı ile üretilmiştir.; Tasarım: Oturur pozisyonda tasarlanmıştır.; Bacakları, bulunduğu yerden sallanacak şekilde hareketlidir, bu da ürünlere sevimli ve dikkat çekici bir hava katar.; Boyutlar: Her bir figür yaklaşık olarak 7 cm (Genişlik) x 6 cm (Yükseklik) ölçülerindedir.; Kullanım Alanı: Kitaplık, masa, raf kenarı, TV ünitesi veya pencere pervazı gibi düz kenarlı tüm yüzeylerde dekoratif amaçlı kullanılabilir.; PLA (Polilaktik Asit) Nedir?Ürünlerimizin üretiminde kullanılan PLA (Polilaktik Asit), günümüzde en popüler 3D yazıcı malzemelerinden biridir.; Çevre Dostu: Mısır nişastası, şeker kamışı gibi yenilenebilir kaynaklardan elde edilen biyolojik olarak parçalanabilir bir termoplastiktir.; Bu özelliği ile çevreye duyarlı bir tercihtir.; Güvenli ve Hafif: Toksik olmayan yapısı sayesinde iç mekan dekorasyonunda güvenle kullanılabilir.; Oldukça hafif bir malzemedir.; Görünüm: Baskı kalitesi yüksektir, ancak 3D baskı teknolojisinin doğası gereği yüzeyde çok ince katman izleri (çizgiler) bulunabilir.; Bu izler, her bir figürü benzersiz kılar.; Not: Görseldeki baston şeker figürü sadece dekorasyon amaçlı gösterilmiştir, satış ilanına sadece 2 adet Kar Tanesi Figürü dahildir.";Dkrsyn16124;Dkrsyn16124;50;249.0;249.0;20;;https://cdn.dsmcdn.com/ty1774/prod/QC_PREP/20251019/15/5c36e9fa-ea30-311f-96fc-8556d37b79d5/1_org_zoom.jpg;https://cdn.dsmcdn.com/ty1774/prod/QC_PREP/20251019/15/36885ee6-afe0-30ec-90ac-0d448350ef62/1_org_zoom.jpg;https://cdn.dsmcdn.com/ty1775/prod/QC_PREP/20251019/15/99503114-ae17-33bf-afdc-1f49ec5bce55/1_org_zoom.jpg;;;;;;;;;;;;;;;;;Beyaz;Tek Ebat;
Modern Dalgalar 3D Baskı Masa Saati | Beyaz Minimalist Dekoratif Saat (10x10 cm);Saat1609;Masa Saati;hivhestın;"Modern tasarımı ve minimalist çizgileriyle yaşam alanlarınıza şıklık katacak bu özel masa saatini sunuyoruz.; Beyaz rengi ve merkezden yayılan üç boyutlu dalga deseniyle, sadece zamanı gösteren bir araç olmanın ötesinde, odanızın odak noktası olacak eşsiz bir dekoratif objedir.; Benzersiz Tasarım: 3D baskının sunduğu imkanlarla üretilen, dokunsal ve görsel açıdan etkileyici, dalga efektli yüzey.; Minimalist ve Şık: Kare formu, sade beyaz rengi ve kontrast oluşturan siyah akrep/yelkovan ile her türlü dekorasyon stiline uyum sağlar.; Boyutlar: 10 cm genişlik ve 10 cm yükseklik.; Kompakt boyutuyla çalışma masası, komodin veya kitaplık üzerinde idealdir.; Teknik DetaylarÜretim Teknolojisi: Yüksek hassasiyetli FDM (Fused Deposition Modeling) 3D Yazıcı ile üretilmiştir.; Malzeme: PLA (Polilaktik Asit)Çalışma: Sessiz ve akıcı çalışan saat mekanizması (1 adet AA pil ile çalışır – Pil pakete dahil değildir).; Renk: BeyazPLA Malzeme Hakkında BilgiBu ürün, çevre dostu ve biyo-bazlı bir termoplastik olan PLA (Polilaktik Asit) kullanılarak üretilmiştir.; PLA, yenilenebilir kaynaklardan (mısır nişastası, şeker kamışı gibi) elde edilen, biyobozunur özelliklere sahip bir polimerdir.; Kokusu yoktur ve dekoratif ürünler için ideal sert ve dayanıklı bir yapı sunar.; Neden Bu Saati Seçmelisiniz?Özgünlük: Seri üretim yerine, bir sanat eseri titizliğiyle 3D yazıcıda, katman katman üretilmiştir.; Hediye Fikri: Modern ve sanatsal bir hediye arayanlar için mükemmel bir seçenektir.; Modern Dekorasyon: Minimalist, İskandinav veya modern tarzdaki ev ve ofisler için idealdir.; Önemli Not: 3D baskı teknolojisinin doğası gereği, ürün yüzeyinde çok küçük katman izleri bulunabilir.; Bu izler, ürünün özgünlüğünü ve üretim tekniğini gösteren doğal bir parçasıdır.";Saat1609;Saat1609;5;659.0;659.0;10;0.0;https://cdn.dsmcdn.com/ty1773/prod/QC_PREP/20251019/15/1d3f286f-993c-3a96-8fa4-5704a656b51c/1_org_zoom.jpg;https://cdn.dsmcdn.com/ty1774/prod/QC_PREP/20251019/15/ed436396-a750-311d-bcb2-e432e9e678be/1_org_zoom.jpg;https://cdn.dsmcdn.com/ty1775/prod/QC_PREP/20251019/15/acf18261-4a2e-3dc1-bf88-efd2952e4f82/1_org_zoom.jpg;https://cdn.dsmcdn.com/ty1774/prod/QC_PREP/20251019/15/da04f572-e2b1-3378-a24e-0f44c31cbffa/1_org_zoom.jpg;;;;;;;;;;;;;;;;Beyaz;Tek Ebat;
Turbo Zamanlayıcı 3D Baskı Spor Araba Lastik ve Fren Diskli Masa Saati (20x20 cm);Saat1608;Masa Saati;hivhestın;"Spor arabaların hız ve estetiğinden ilham alarak tasarlanmış, benzersiz bir dekoratif saat ile tanışın.; Lastik, jant ve neon sarı/yeşil fren diski detaylarıyla aracınızın ruhunu masanıza taşıyın.; Öne Çıkan Özellikler:Benzersiz Tasarım: Spor araba lastiği ve perfore fren diski (fren kaliperi detaylı) görünümü.3D Yazıcı Teknolojisi: Son teknoloji 3D baskı ile katman katman özenle üretilmiştir.; İdeal Boyut: 20 cm yükseklik, 20 cm genişlik ve 7 cm derinlik ile masa, raf veya komodinlerinizde mükemmel duruş sağlar.; Renkler: Siyah lastik, altın/bronz renkli jant ve dikkat çekici neon sarı/yeşil fren diski kombinasyonu.; Malzeme: Sağlam ve çevre dostu PLA (Polilaktik Asit) malzemeden üretilmiştir.; PLA Malzeme Hakkında BilgiÜrünümüzün hammaddesi olan PLA (Polilaktik Asit), 3D yazıcı baskılarında en sık kullanılan malzemelerden biridir.; Çevre Dostu: Mısır nişastası, şeker kamışı gibi yenilenebilir kaynaklardan elde edilen biyolojik olarak parçalanabilir bir termoplastiktir.; Güvenli ve Sağlam: Toksik değildir ve iyi bir sertliğe sahiptir.; Dekoratif Kullanıma Uygun: Ev ve ofis ortamlarında dekoratif ürünler için ideal bir yüzey kalitesine sahiptir.; Isı Hassasiyeti: Yüksek sıcaklıklara (örneğin doğrudan güneş ışığına maruz kalacak sıcak bir araba içi) uzun süre maruz bırakılmaması önerilir.; Kullanım Alanları:Otomobil tutkunları için harika bir hediye.; Ofis masası, çalışma odası veya genç odası dekorasyonu.; Araba sever dostlara özel gün hediyesi.; Önemli Not: Ürününüz 3D yazıcı teknolojisiyle üretildiği için, yüzeyinde çok yakından bakıldığında hafif katman izleri bulunabilir.; Bu durum, ürünün özel üretim olduğunu gösteren doğal bir özelliktir.; Ürün Bilgileri Kategori: Ev ve Yaşam / Dekorasyon / Saat / Masa SaatiÜrün Adı: Turbo ZamanlayıcıMateryal/Malzeme: PLA (3D Baskı)Ürün Boyutları:Yükseklik: 20 cmGenişlik: 20 cmDerinlik: 7 cmRenk: Çok Renkli (Siyah, Altın/Bronz, Neon Yeşil/Sarı)Mekanizma: Pilli (Genellikle Sessiz Akar Mekanizma)";Saat1608;Saat1608;1;1499.0;1499.0;20;;https://cdn.dsmcdn.com/ty1775/prod/QC_PREP/20251019/14/e79c46e5-da9b-34f7-8bbb-59b28665a51e/1_org_zoom.jpg;https://cdn.dsmcdn.com/ty1773/prod/QC_PREP/20251019/14/47840172-70a1-3c54-84af-5f8bb7b44072/1_org_zoom.jpg;https://cdn.dsmcdn.com/ty1775/prod/QC_PREP/20251019/14/fd6d01cb-aa94-36a7-8b1a-0971b43bb5dd/1_org_zoom.jpg;;;;;;;;;;;;;;;;;Siyah;Tek Ebat;
Örümcek Adam Temalı Kitap Tutucu Seti - 3D Baskı Sanatı;Bknk1614;Kitap Tutucu;hivhestın;"Ürün Açıklaması:Kitaplarınıza dinamik bir görünüm katın! Marvel evreninin en sevilen kahramanlarından Örümcek Adamın macera dolu anını yansıtan bu özel tasarım kitap tutucu set, hem bir düzenleyici hem de dekoratif bir sanat eseridir.; Örümcek Adam figürünün ağ atışıyla iki kitap bloğunu birbirine bağladığı bu set, kitaplığınızın odak noktası olacak.; Tema: Örümcek Adam Malzeme: Yüksek kaliteli PLA (Polilaktik Asit)Teknoloji: Hassas FDM 3D Yazıcı BaskıBoyut: Ortalama 17 cm YükseklikSet İçeriği: 1 adet Örümcek Adam figürlü tutucu ve 1 adet tuğla duvar desenli tutucu.; Kullanım: Kitaplarınızı dik tutmak ve kitaplığınıza özgün bir hava katmak için idealdir.; Not: Görseldeki kitaplar dekor amaçlıdır, satışa dahil değildir.; Malzeme Bilgisi: Neden PLA?Ürünümüzün üretiminde çevre dostu bir termoplastik olan PLA (Polilaktik Asit) malzeme kullanılmıştır.; Çevre Dostu: Mısır nişastası veya şeker kamışı gibi yenilenebilir kaynaklardan elde edilir ve biyolojik olarak çözünebilir özelliktedir.; Bu özelliğiyle en popüler 3D baskı malzemelerinden biridir.; Dayanıklılık: Hafif olmasına rağmen günlük kullanıma uygun yeterli sertliğe ve dayanıklılığa sahiptir.; Güvenlik: Kokusuz ve güvenli yapısı sayesinde iç mekan dekorasyon ürünleri için gönül rahatlığıyla tercih edilebilir.; Detay Kalitesi: 3D baskıda sunduğu yüksek detay çözünürlüğü sayesinde Örümcek Adam figürünün ve diğer detayların net bir şekilde görünmesini sağlar.; Kitaplığınıza Kahraman Dokunuşu! Hemen Sipariş Verin!";Bknk1614;Bknk1614;1;1499.0;1499.0;20;;https://cdn.dsmcdn.com/ty1775/prod/QC_PREP/20251019/12/cca740d9-4f48-36e8-9186-00219fabcc9d/1_org_zoom.jpg;;;;;;;;;;;;;;;;;;;Kırmızı;Tek Ebat;
