Zarif Geyik Dağ Formunda 3D Baskı Dekoratif Heykel - 16 cm;Dkrsyn16164;Dekoratif Obje ve Biblo;hivhestın;"Evinizin veya ofisinizin atmosferine doğal bir zarafet ve modern bir dokunuş katacak, özel tasarım 3D baskı geyik heykelimizle tanışın! Minimalist çizgileri ve dinamik duruşuyla bu özel parça, dekorasyonunuzun odak noktası olmaya aday.; Ürün Özellikleri:Malzeme: Yüksek kaliteli ve çevre dostu PLA (Polilaktik Asit) malzeme kullanılarak 3D yazıcı teknolojisi ile üretilmiştir.; Boyut: 16 cm (yaklaşık) yüksekliğiyle, masaüstü, raf veya vitrin gibi alanlarda rahatlıkla sergilenebilir.; Tasarım: Dağ formundaki kaidesiyle bütünleşen, koşan bir geyiğin zarif siluetini yansıtan modern ve estetik bir tasarım.; Üretim: Her bir detayına özen gösterilerek son teknoloji 3D yazıcılarımızda basılmıştır.; Bu sayede pürüzsüz yüzeyler ve keskin hatlar elde edilmiştir.; Kullanım Alanı: Oturma odası, yatak odası, çalışma odası, ofis veya antre gibi birçok alanda estetik bir görünüm sağlar.; Sevdiklerinize hediye etmek için de harika bir seçenektir.; PLA Malzeme Hakkında Bilgi:PLA (Polilaktik Asit), yenilenebilir kaynaklardan (mısır nişastası, şeker kamışı gibi bitkisel kaynaklar) elde edilen biyolojik olarak parçalanabilen ve çevre dostu bir termoplastiktir.; 3D baskı dünyasında en popüler malzemelerden biridir.; Çevre Dostu: Petrol bazlı plastiklerin aksine, doğada daha kısa sürede çözünebilir ve karbon ayak izi daha düşüktür.; Dayanıklı: Günlük kullanım için yeterli dayanıklılığa sahiptir.; Güvenli: Gıda ile temas için genellikle güvenli kabul edilse de, bu ürün dekoratif amaçlıdır.; Hafif: Ürüne hafif ama sağlam bir yapı kazandırır.; Neden Bu Geyik Heykeli?Modern ve doğal tasarımın birleşimiyle, yaşam alanlarınıza huzur ve estetik katacak.; 3D baskının getirdiği eşsiz detaylar ve çevre dostu PLA malzeme seçimiyle hem gözünüze hem de doğaya saygılı bir ürün sunuyoruz.; Hemen sipariş verin ve evinize bu özel dokunuşu katın!";Dkrsyn16164;Dkrsyn16164;50;369.0;369.0;20;0.0;https://cdn.dsmcdn.com/ty1786/prod/QC_PREP/20251109/16/b7c9bde5-669d-3a67-b018-bdfc68c06ad7/1_org_zoom.jpg;https://cdn.dsmcdn.com/ty1786/prod/QC_PREP/20251109/16/e49e5da5-8900-3dde-9726-8f6aac591cfc/1_org_zoom.jpg;https://cdn.dsmcdn.com/ty1786/prod/QC_PREP/20251109/16/1ff5d431-d84b-3838-9fab-61bc5b2c06b3/1_org_zoom.jpg;;;;;;;;;;;;;;;;;Siyah;Tek Ebat;
Modern Figür Sergileme Rafı | 3D Baskı PLA | 15x16 cm Koleksiyonluk Stand;Dkrsyn16163;Duvar Rafı;hivhestın;"Ürün AçıklamasıÜrün Adı: S-Form Figür Sergileme RafıKoleksiyonunuzu Öne Çıkarın: Figür, Lego, maket ve küçük objelerinizi modern ve estetik bir şekilde sergilemeniz için özel olarak tasarlanmıştırk.; S şeklindeki akıcı formuyla odanıza veya çalışma masanıza sofistike bir dokunuş katar.; Malzeme Kalitesi: Çevre Dostu ve Dayanıklı PLABu özel raf, en son teknoloji 3D Yazıcı Baskı yöntemiyle, yüksek kaliteli PLA (Poliaktik Asit) malzemeden üretilmiştir.; PLA Nedir? PLA, mısır nişastası gibi yenilenebilir kaynaklardan elde edilen, biyolojik olarak parçalanabilir çevre dostu bir termoplastiktir.; Hafif yapısına rağmen yüksek dayanıklılık sunar.; Sağlığa zararlı madde içermez, bu sayede ev içi kullanım için ideal ve güvenli bir seçimdir.; Ölçüler:Genişlik: 15 cmDerinlik: 16 cmYükseklik: 16 cmNot: Ölçüler, üretim toleranslarına bağlı olarak küçük farklılıklar gösterebilir.; Temel ÖzelliklerTasarım: S-Form modern ve minimalist yapı.; Üretim Yöntemi: Yüksek hassasiyetli 3D Baskı.; Kullanım Alanı: Masaüstü, raf içi veya duvar ünitesi üzerinde figür, mini saksı veya küçük objeleri sergilemek için idealdir.; Ek Satış Detayları (Müşteri Bilgilendirmesi)Renk Seçeneği: GriÖnemli Not: Ürün sadece rafın kendisidir.; Görselde yer alan figür ve objeler çekim amaçlı kullanılmıştır, pakete dahil değildir.; Bakım: Kimyasal temizleyiciler kullanmadan, nemli bir bezle silinerek kolayca temizlenebilir.";Dkrsyn16163;Dkrsyn16163;10;599.0;599.0;20;;https://cdn.dsmcdn.com/ty1786/prod/QC_PREP/20251108/17/2f20101f-b3a7-3493-a7ea-be6e960203b7/1_org_zoom.jpg;https://cdn.dsmcdn.com/ty1785/prod/QC_PREP/20251108/17/678b168d-cf71-3329-a3f2-b6bbf236d571/1_org_zoom.jpg;https://cdn.dsmcdn.com/ty1786/prod/QC_PREP/20251108/17/822dc947-3048-3300-9e56-84a2f3d215ac/1_org_zoom.jpg;;;;;;;;;;;;;;;;;Gri;Tek Ebat;
Yel Değirmeni Figürlü Dekoratif Biblo - 3D Baskı (Pastel Yeşil);Dkrsyn16162;Dekoratif Obje ve Biblo;hivhestın;"Yaşam alanlarınıza huzurlu ve estetik bir dokunuş katın! Pastel Yel Değirmeni Figürlü Biblomuz, şık tasarımı ve pastel yeşil rengiyle odanıza sıcak bir atmosfer getirecek.; Masaüstü, raf veya konsol dekorasyonunuz için idealdir.; Ürün ÖzellikleriÜrün Adı: Pastel Yel Değirmeni Figürlü Dekoratif BibloBoyut: Yüksekliği 20 cm'dir.; Kompakt ve zarif yapısıyla her köşeye kolayca uyum sağlar.; Malzeme: Yüksek kaliteli, çevre dostu PLA (Polilaktik Asit) malzemeden 3D yazıcı ile üretilmiştir.; Renk: İç mekanlara ferahlık ve dinginlik katacak özel Pastel Açık Yeşil rengindedir.; PLA Malzeme Nedir?PLA (Polilaktik Asit), mısır nişastası veya şeker kamışı gibi yenilenebilir bitkisel kaynaklardan elde edilen biyolojik olarak parçalanabilen bir plastiktir.; Sürdürülebilir Üretim: Petrol bazlı plastiklere göre daha çevre dostu bir alternatiftir.; Hafif ve Estetik: Dekoratif ürünler için uygun sağlamlıkta ve hafifliktedir.; Önemli Not: 3D Baskı Ürün Kusurları Hakkında BilgilendirmeBu ürün bir seri üretim değil, 3D yazıcı teknolojisiyle katman katman üretilen özel bir tasarımdır.; Bu üretim tekniğinden kaynaklanan bazı doğal özellikler bulunmaktadır:Katman İzleri: Ürünün yüzeyinde, baskı sürecinin doğası gereği, yatay ince katman çizgileri (layer lines) görülebilir.; Bu izler, 3D baskının karakteristik ve eşsiz bir özelliğidir.; Yüzey Detayları: Baskı başlangıç/bitiş noktalarında veya yüzeyin bazı kısımlarında küçük pürüzler veya minik izler oluşabilir.; Bu özellikler ürünün dayanıklılığını ve dekoratif kalitesini etkilemez; aksine, ürünün özel üretim olduğunu gösterir.; Önemli Bilgi: Bu ürün sadece dekoratif amaçlı bir biblodur.; Herhangi bir mekanik, elektrikli veya hareketli bir işlevi (dönen pervane vb.; ) bulunmamaktadır.; Evinize veya ofisinize nostaljik ve modern bir dokunuş katacak bu özel tasarım yel değirmeni bibloyu hemen sipariş verin!";Dkrsyn16162;Dkrsyn16162;10;889.0;889.0;20;0.0;https://cdn.dsmcdn.com/ty1786/prod/QC_PREP/20251108/17/9dd4f95d-b138-375b-baa9-182d3cd062f1/1_org_zoom.jpg;;;;;;;;;;;;;;;;;;;Yeşil;Tek Ebat;
Geometrik Geyik Başı Dekoratif Heykel - 3D Baskı (Siyah & Beyaz) 25 Cm;Dkrsyn16161;Dekoratif Obje ve Biblo;hivhestın;"Ev dekorasyonunuza modern ve sanatsal bir dokunuş katmak isteyenler için özel olarak tasarlanmış Geometrik Geyik Başı Heykelimiz! 3D yazıcı teknolojisiyle özenle üretilen bu eşsiz parça, minimalist ve şık tasarımıyla dikkat çekiyor.; Ürün ÖzellikleriÜrün Adı: Geometrik Geyik Başı Dekoratif HeykelBoyut: Yüksekliği 25 cm'dir.; Bu ideal boyutuyla raflarda, konsollarda veya çalışma masanızda kolayca yer bulur.; Malzeme: Yüksek kaliteli ve çevre dostu PLA (Polilaktik Asit) malzemeden üretilmiştir.; Renk Seçenekleri: Mekanınıza ve tarzınıza uygun olarak klasik Siyah ve zarif Beyaz renk seçenekleri mevcuttur.; PLA Malzeme Nedir?PLA (Polilaktik Asit), mısır nişastası, şeker kamışı gibi yenilenebilir kaynaklardan elde edilen biyolojik olarak parçalanabilen termoplastik bir polimerdir.; 3D baskı dünyasında en popüler malzemelerden biridir.; Çevre Dostu: Biyobozunur yapısıyla çevre üzerinde daha az etki bırakır.; Dayanıklı ve Hafif: Dekoratif ürünler için ideal sağlamlık ve hafiflik sunar.; Önemli Not: 3D Baskı Ürün Kusurları Hakkında BilgilendirmeBu ürün bir seri üretim ürünü değil, 3D yazıcı teknolojisiyle katman katman üretilen el işçiliği içeren bir üründür.; Bu üretim tekniğinden kaynaklanan ve kusur sayılmayan bazı karakteristik özellikler bulunmaktadır.; Lütfen sipariş vermeden önce bu bilgileri dikkate alın:Katman İzleri: Ürünün yüzeyinde, baskı sürecinin doğası gereği, yatay ince katman çizgileri (layer lines) görülebilir.; Bu izler, 3D baskının karakteristik özelliğidir ve heykelin geometrik yapısına ayrı bir doku katar.; Baskı Başlangıç/Bitiş Noktaları (Seam): Baskının başladığı veya bittiği noktalarda (genellikle ürünün daha az görünür bölgelerinde) küçük bir çizgi veya nokta izi oluşabilir.; Yüzey Kusurları: Çok nadiren de olsa, küçük ipliklenmeler (stringing), kabarcıklar veya minik çukurlar görülebilir.; Bu özellikler ürünün dayanıklılığını ve görsel kalitesini etkilemez; aksine, ürünün eşsiz ve özel üretim olduğunu gösterir.; Fotoğraflarımızda gördüğünüz ürünler, alacağınız ürünün en yakın temsilidir.; Bu modern ve estetik geyik başı heykeliyle yaşam alanlarınıza sofistike bir atmosfer katın! Hemen sepetinize ekleyin!";Dkrsyn16161;Dkrsyn16161;10;529.0;529.0;20;;https://cdn.dsmcdn.com/ty1786/prod/QC_PREP/20251107/12/34b65b1b-a842-3a6c-857f-f16d7f5bfc05/1_org_zoom.jpg;https://cdn.dsmcdn.com/ty1785/prod/QC_PREP/20251107/12/7fb78289-1736-3d24-bb29-0f42c9db68e2/1_org_zoom.jpg;https://cdn.dsmcdn.com/ty1786/prod/QC_PREP/20251107/12/9f48ae9b-4a2b-30b0-920e-43d4f8c43e19/1_org_zoom.jpg;;;;;;;;;;;;;;;;;Beyaz;Tek Ebat;
Geometrik Geyik Başı Dekoratif Heykel - 3D Baskı (Siyah & Beyaz) 25 Cm;Dkrsyn16161-1;Dekoratif Obje ve Biblo;hivhestın;"Ev dekorasyonunuza modern ve sanatsal bir dokunuş katmak isteyenler için özel olarak tasarlanmış Geometrik Geyik Başı Heykelimiz! 3D yazıcı teknolojisiyle özenle üretilen bu eşsiz parça, minimalist ve şık tasarımıyla dikkat çekiyor.; Ürün ÖzellikleriÜrün Adı: Geometrik Geyik Başı Dekoratif HeykelBoyut: Yüksekliği 25 cm'dir.; Bu ideal boyutuyla raflarda, konsollarda veya çalışma masanızda kolayca yer bulur.; Malzeme: Yüksek kaliteli ve çevre dostu PLA (Polilaktik Asit) malzemeden üretilmiştir.; Renk Seçenekleri: Mekanınıza ve tarzınıza uygun olarak klasik Siyah ve zarif Beyaz renk seçenekleri mevcuttur.; PLA Malzeme Nedir?PLA (Polilaktik Asit), mısır nişastası, şeker kamışı gibi yenilenebilir kaynaklardan elde edilen biyolojik olarak parçalanabilen termoplastik bir polimerdir.; 3D baskı dünyasında en popüler malzemelerden biridir.; Çevre Dostu: Biyobozunur yapısıyla çevre üzerinde daha az etki bırakır.; Dayanıklı ve Hafif: Dekoratif ürünler için ideal sağlamlık ve hafiflik sunar.; Önemli Not: 3D Baskı Ürün Kusurları Hakkında BilgilendirmeBu ürün bir seri üretim ürünü değil, 3D yazıcı teknolojisiyle katman katman üretilen el işçiliği içeren bir üründür.; Bu üretim tekniğinden kaynaklanan ve kusur sayılmayan bazı karakteristik özellikler bulunmaktadır.; Lütfen sipariş vermeden önce bu bilgileri dikkate alın:Katman İzleri: Ürünün yüzeyinde, baskı sürecinin doğası gereği, yatay ince katman çizgileri (layer lines) görülebilir.; Bu izler, 3D baskının karakteristik özelliğidir ve heykelin geometrik yapısına ayrı bir doku katar.; Baskı Başlangıç/Bitiş Noktaları (Seam): Baskının başladığı veya bittiği noktalarda (genellikle ürünün daha az görünür bölgelerinde) küçük bir çizgi veya nokta izi oluşabilir.; Yüzey Kusurları: Çok nadiren de olsa, küçük ipliklenmeler (stringing), kabarcıklar veya minik çukurlar görülebilir.; Bu özellikler ürünün dayanıklılığını ve görsel kalitesini etkilemez; aksine, ürünün eşsiz ve özel üretim olduğunu gösterir.; Fotoğraflarımızda gördüğünüz ürünler, alacağınız ürünün en yakın temsilidir.; Bu modern ve estetik geyik başı heykeliyle yaşam alanlarınıza sofistike bir atmosfer katın! Hemen sepetinize ekleyin!";Dkrsyn16161-1;Dkrsyn16161;10;529.0;529.0;20;;https://cdn.dsmcdn.com/ty1787/prod/QC_PREP/20251107/12/8f4f4c2d-69f3-35c8-8891-53427768ad8f/1_org_zoom.jpg;https://cdn.dsmcdn.com/ty1786/prod/QC_PREP/20251107/12/fb1db593-42ce-3400-bf3a-e1f9258ccb0d/1_org_zoom.jpg;https://cdn.dsmcdn.com/ty1787/prod/QC_PREP/20251107/12/7cc7e06e-2aa7-342f-88cf-93f2487837c3/1_org_zoom.jpg;;;;;;;;;;;;;;;;;Siyah;Tek Ebat;
İki Kalp Bir Aşk | Modern Siyah 3D Baskı Çift Heykeli (15 cm) | PLA Malzeme | Romantik Ev Dekoru;Dkrsyn16160-1;Dekoratif Obje ve Biblo;hivhestın;"Ürün HakkındaBu büyüleyici ""İki Kalp Bir Aşk"" heykeli, birbirine sımsıkı sarılmış iki sevgilinin sonsuz aşkını, bağlılığını ve tutkusunu modern, sanatsal bir formda yansıtır.; Evinizin atmosferine romantik ve zarif bir dokunuş katacak bu heykel, aşkınızı kutlamanın en güzel yollarından biridir.; Siyah rengin asil duruşu, heykelin duygusal derinliğini daha da vurgular.; Ürün Adı: İki Kalp Bir Aşk HeykeliÜretim Teknolojisi: Yüksek hassasiyetli FDM 3D Yazıcı BaskıMalzeme: Çevre Dostu ve Biyobozunur PLA (Polilaktik Asit)Boyut: 15 cm (Yükseklik)Renk: Şık ve Asil SiyahPLA Malzeme (Polilaktik Asit) BilgisiÜrünlerimiz, mısır nişastası gibi yenilenebilir bitkisel kaynaklardan elde edilen biyobozunur bir termoplastik olan PLA malzemeden üretilmiştir.; Çevre Dostu: Yenilenebilir kaynaklardan üretilir ve doğa dostu bir alternatiftir.; Sağlıklı Kullanım: Baskı işlemi sırasında zararlı kimyasal gaz veya koku yaymaz, iç mekanlarda güvenle kullanılabilir.; Dayanıklılık: Hafif ve sert yapısıyla dekoratif objeler için gereken dayanıklılığı sunar.; Uyarı: PLA, yüksek ısıya (yaklaşık 60°C ve üzeri) karşı hassastır.; Ürünün doğrudan uzun süreli güneş ışığına veya ısı kaynaklarına maruz kalmaması önerilir.3D Baskı (FDM) Üretim Özellikleri ve BeklentilerÜrününüz, FDM 3D baskı teknolojisi ile katman katman üretilmiştir.; Bu teknik, ürüne özgün ve sanatsal bir karakter katar.; Katman Çizgileri: FDM baskının doğası gereği, heykelin yüzeyinde çok küçük yatay katman çizgileri görülebilir.; Bu çizgiler bir kusur değil, teknolojik üretim sürecinin doğal bir sonucudur.; Minimal Pürüzler: Baskı başlangıç/bitiş noktalarında veya destek malzemesi çıkarılan bölgelerde çok küçük noktalar veya hafif pürüzler oluşabilir.; Bu izler, ürünün estetiğini etkilemeyen normal üretim izleridir.; Not: Satın aldığınız bu ürün, seri üretim fabrikasyon ürünler gibi tamamen pürüzsüz değildir.; Her heykel, 3D baskı teknolojisinin sağladığı benzersiz ve hafifçe dokulu bir yüzeye sahiptir.; Kullanım Alanları ve Hediye FikirleriSevgililer Günü, Yıl Dönümü, Doğum Günü gibi özel günler için anlamlı ve modern bir hediye.; Yatak Odası, Oturma Odası, Konsol Üstü Dekorasyonu.";Dkrsyn16160-1;Dkrsyn16160;50;389.0;389.0;20;;https://cdn.dsmcdn.com/ty1787/prod/QC_PREP/20251107/11/d634b003-3dfd-3c13-a0ea-e606ad30644d/1_org_zoom.jpg;https://cdn.dsmcdn.com/ty1787/prod/QC_PREP/20251107/11/aa0a6583-89a5-3601-8488-e9f759e343d1/1_org_zoom.jpg;;;;;;;;;;;;;;;;;;Siyah;Tek Ebat;
İki Kalp Bir Aşk | Modern Siyah 3D Baskı Çift Heykeli (15 cm) | PLA Malzeme | Romantik Ev Dekoru;Dkrsyn16160;Dekoratif Obje ve Biblo;hivhestın;"Ürün HakkındaBu büyüleyici ""İki Kalp Bir Aşk"" heykeli, birbirine sımsıkı sarılmış iki sevgilinin sonsuz aşkını, bağlılığını ve tutkusunu modern, sanatsal bir formda yansıtır.; Evinizin atmosferine romantik ve zarif bir dokunuş katacak bu heykel, aşkınızı kutlamanın en güzel yollarından biridir.; Siyah rengin asil duruşu, heykelin duygusal derinliğini daha da vurgular.; Ürün Adı: İki Kalp Bir Aşk HeykeliÜretim Teknolojisi: Yüksek hassasiyetli FDM 3D Yazıcı BaskıMalzeme: Çevre Dostu ve Biyobozunur PLA (Polilaktik Asit)Boyut: 15 cm (Yükseklik)Renk: Şık ve Asil SiyahPLA Malzeme (Polilaktik Asit) BilgisiÜrünlerimiz, mısır nişastası gibi yenilenebilir bitkisel kaynaklardan elde edilen biyobozunur bir termoplastik olan PLA malzemeden üretilmiştir.; Çevre Dostu: Yenilenebilir kaynaklardan üretilir ve doğa dostu bir alternatiftir.; Sağlıklı Kullanım: Baskı işlemi sırasında zararlı kimyasal gaz veya koku yaymaz, iç mekanlarda güvenle kullanılabilir.; Dayanıklılık: Hafif ve sert yapısıyla dekoratif objeler için gereken dayanıklılığı sunar.; Uyarı: PLA, yüksek ısıya (yaklaşık 60°C ve üzeri) karşı hassastır.; Ürünün doğrudan uzun süreli güneş ışığına veya ısı kaynaklarına maruz kalmaması önerilir.3D Baskı (FDM) Üretim Özellikleri ve BeklentilerÜrününüz, FDM 3D baskı teknolojisi ile katman katman üretilmiştir.; Bu teknik, ürüne özgün ve sanatsal bir karakter katar.; Katman Çizgileri: FDM baskının doğası gereği, heykelin yüzeyinde çok küçük yatay katman çizgileri görülebilir.; Bu çizgiler bir kusur değil, teknolojik üretim sürecinin doğal bir sonucudur.; Minimal Pürüzler: Baskı başlangıç/bitiş noktalarında veya destek malzemesi çıkarılan bölgelerde çok küçük noktalar veya hafif pürüzler oluşabilir.; Bu izler, ürünün estetiğini etkilemeyen normal üretim izleridir.; Not: Satın aldığınız bu ürün, seri üretim fabrikasyon ürünler gibi tamamen pürüzsüz değildir.; Her heykel, 3D baskı teknolojisinin sağladığı benzersiz ve hafifçe dokulu bir yüzeye sahiptir.; Kullanım Alanları ve Hediye FikirleriSevgililer Günü, Yıl Dönümü, Doğum Günü gibi özel günler için anlamlı ve modern bir hediye.; Yatak Odası, Oturma Odası, Konsol Üstü Dekorasyonu.";Dkrsyn16160;Dkrsyn16160;50;389.0;389.0;20;;https://cdn.dsmcdn.com/ty1786/prod/QC_PREP/20251107/11/5680d3ac-0b8f-387b-805b-82b798f29075/1_org_zoom.jpg;https://cdn.dsmcdn.com/ty1787/prod/QC_PREP/20251107/11/a1c8c714-ad94-3f17-91cf-55e04b6d8bac/1_org_zoom.jpg;;;;;;;;;;;;;;;;;;Beyaz;Tek Ebat;
Sonsuz Kucaklaşma - Modern Tasarım 3D Baskı Sevgi Heykeli (20 cm);Dkrsyn16159;Dekoratif Obje ve Biblo;hivhestın;"Sevginin en saf ve modern halini yansıtan bu özel tasarım heykel, evinizin veya ofisinizin en dikkat çekici köşesi olacak.; ""Sonsuz Kucaklaşma"" adını verdiğimiz bu parça, iki figürün uyumlu birlikteliğini temsil ederken, merkezdeki kırmızı kalp detayı ile duygusal derinliği artırır.; Bu heykel, son teknoloji 3D Yazıcı baskı yöntemiyle üretilmiştir.; Eşsiz bir hediye arayanlar, yeni ev kuranlar veya modern sanat meraklıları için idealdir.; Teknik Detaylar:Boyut: Yaklaşık 20 cm boyunda.; Üretim Teknolojisi: FDM 3D BaskıMalzeme: Yüksek Kaliteli PLA (Polilaktik Asit)Renk Seçenekleri: Siyah ve Beyaz gövde rengi seçenekleriyle sunulmaktadır.; (Kalp detayı tüm renklerde kırmızıdır.; )3D Baskı Ürün Notu (Lütfen Okuyunuz)Bu ürün, katman bazlı bir üretim tekniği olan 3D baskı ile üretilmektedir.; Bu nedenle, yüzeyde milimetrik düzeyde katman çizgileri ve çok küçük izler görülebilir.; Bu durum, ürünün kusuru değil, tamamen baskı teknolojisinin doğasından kaynaklanan, ona özgün bir doku ve el yapımı hissi veren bir özelliğidir.; Her ürün tektir.; PLA Malzeme Hakkında BilgilendirmeÜrünümüzün ana malzemesi olan PLA (Polilaktik Asit), 3D baskıda en yaygın ve çevre dostu kullanılan termoplastiklerden biridir.; Doğa Dostu: Mısır nişastası veya şeker kamışından elde edilir.; Geri dönüştürülebilir ve biyolojik olarak çözünebilir bir yapıya sahiptir.; Dayanıklı ve Hafif: Dekoratif ürünler için mükemmel mukavemet ve hafiflik sunar.; Güvenli: Toksik değildir ve kokusuzdur, bu da onu iç mekan kullanımı için ideal hale getirir.; Bakım Notu: Doğrudan güneş ışığına uzun süre maruz bırakmaktan kaçınınız.; Neden Tercih Etmelisiniz?Özgün Tasarım: Başka yerde bulamayacağınız, modern ve anlamlı bir sanat eseri.; Renk Alternatifleri: Dekorasyonunuza en uygun olanı seçebilmeniz için Siyah ve Beyaz seçenekleri mevcuttur.; Mükemmel Hediye: Anneler Günü, Babalar Günü, Sevgililer Günü, evlilik yıl dönümü veya yeni ev hediyesi için unutulmaz bir seçim.; Detaylı İşçilik: 3D baskının sağladığı ince katmanlı dokusu ile ürünün özgün bir el yapımı hissi vardır";Dkrsyn16159;Dkrayn16159;50;629.0;629.0;20;0.0;https://cdn.dsmcdn.com/ty1787/prod/QC_PREP/20251107/11/eff67c2f-368a-3eeb-97a3-7a369a9b9da6/1_org_zoom.jpg;https://cdn.dsmcdn.com/ty1785/prod/QC_PREP/20251107/11/424c1ec6-4371-3960-b997-37d0f75ff037/1_org_zoom.jpg;https://cdn.dsmcdn.com/ty1785/prod/QC_PREP/20251107/11/9b224d98-133e-35df-bcb5-55a937dd0446/1_org_zoom.jpg;;;;;;;;;;;;;;;;;Beyaz;Tek Ebat;
Sonsuz Kucaklaşma - Modern Tasarım 3D Baskı Sevgi Heykeli (20 cm);Dkrsyn16159-1;Dekoratif Obje ve Biblo;hivhestın;"Sevginin en saf ve modern halini yansıtan bu özel tasarım heykel, evinizin veya ofisinizin en dikkat çekici köşesi olacak.; ""Sonsuz Kucaklaşma"" adını verdiğimiz bu parça, iki figürün uyumlu birlikteliğini temsil ederken, merkezdeki kırmızı kalp detayı ile duygusal derinliği artırır.; Bu heykel, son teknoloji 3D Yazıcı baskı yöntemiyle üretilmiştir.; Eşsiz bir hediye arayanlar, yeni ev kuranlar veya modern sanat meraklıları için idealdir.; Teknik Detaylar:Boyut: Yaklaşık 20 cm boyunda.; Üretim Teknolojisi: FDM 3D BaskıMalzeme: Yüksek Kaliteli PLA (Polilaktik Asit)Renk Seçenekleri: Siyah ve Beyaz gövde rengi seçenekleriyle sunulmaktadır.; (Kalp detayı tüm renklerde kırmızıdır.; )3D Baskı Ürün Notu (Lütfen Okuyunuz)Bu ürün, katman bazlı bir üretim tekniği olan 3D baskı ile üretilmektedir.; Bu nedenle, yüzeyde milimetrik düzeyde katman çizgileri ve çok küçük izler görülebilir.; Bu durum, ürünün kusuru değil, tamamen baskı teknolojisinin doğasından kaynaklanan, ona özgün bir doku ve el yapımı hissi veren bir özelliğidir.; Her ürün tektir.; PLA Malzeme Hakkında BilgilendirmeÜrünümüzün ana malzemesi olan PLA (Polilaktik Asit), 3D baskıda en yaygın ve çevre dostu kullanılan termoplastiklerden biridir.; Doğa Dostu: Mısır nişastası veya şeker kamışından elde edilir.; Geri dönüştürülebilir ve biyolojik olarak çözünebilir bir yapıya sahiptir.; Dayanıklı ve Hafif: Dekoratif ürünler için mükemmel mukavemet ve hafiflik sunar.; Güvenli: Toksik değildir ve kokusuzdur, bu da onu iç mekan kullanımı için ideal hale getirir.; Bakım Notu: Doğrudan güneş ışığına uzun süre maruz bırakmaktan kaçınınız.; Neden Tercih Etmelisiniz?Özgün Tasarım: Başka yerde bulamayacağınız, modern ve anlamlı bir sanat eseri.; Renk Alternatifleri: Dekorasyonunuza en uygun olanı seçebilmeniz için Siyah ve Beyaz seçenekleri mevcuttur.; Mükemmel Hediye: Anneler Günü, Babalar Günü, Sevgililer Günü, evlilik yıl dönümü veya yeni ev hediyesi için unutulmaz bir seçim.; Detaylı İşçilik: 3D baskının sağladığı ince katmanlı dokusu ile ürünün özgün bir el yapımı hissi vardır";Dkrsyn16159-1;Dkrayn16159;50;629.0;629.0;20;;https://cdn.dsmcdn.com/ty1785/prod/QC_PREP/20251107/11/bbd2e066-833d-3c33-8b21-a2d74f912f02/1_org_zoom.jpg;https://cdn.dsmcdn.com/ty1785/prod/QC_PREP/20251107/11/6a5e324b-c80e-30fe-aa37-a108abac8fbb/1_org_zoom.jpg;;;;;;;;;;;;;;;;;;Siyah;Tek Ebat;
